"atqro_code","atq_code","atqro_label","atqro_sequence","atqro_is_default","atqro_is_active","atqro_score_risk"
"P-02-R03","P-02","Per-key and per-endpoint rate limits documented and enforced","3","N","Y","50"
"P-02-R04","P-02","Adaptive rate limiting with behavioral anomaly detection and customer-configurable limits","4","N","Y","75"
"P-02-R05","P-02","ML-based abuse detection with real-time adaptive throttling and contractual protection guarantees","5","N","Y","100"
"P-03-R01","P-03","No server-side input validation or sanitization of API payloads","1","Y","Y","0"
"P-03-R02","P-03","Basic input length limits and character filtering applied","2","N","Y","25"
"P-03-R03","P-03","Vendor validates inputs against defined schemas with documented safety filtering","3","N","Y","50"
"P-03-R04","P-03","Multi-layer input validation with DLP scanning and customer-configurable filtering rules","4","N","Y","75"
"P-03-R05","P-03","Zero-trust input pipeline with real-time payload inspection, customer-managed policies, and independent audit","5","N","Y","100"
"P-04-R01","P-04","Single API key grants access to all resources and operations without restriction","1","Y","Y","0"
"P-04-R02","P-04","Broad role-based access with limited granularity","2","N","Y","25"
"P-04-R03","P-04","Granular RBAC with per-resource and per-operation scoping available","3","N","Y","50"
"P-04-R04","P-04","Fine-grained access control with customer-managed policies and least-privilege enforcement","4","N","Y","75"
"P-04-R05","P-04","Dynamic, context-aware access control with JIT provisioning and independent audit","5","N","Y","100"
"P-09-R01","P-09","Vendor provides no usage logs or audit trail to customers","1","Y","Y","0"
"P-09-R02","P-09","Basic usage metrics available but no detailed request-level logging","2","N","Y","25"
"P-09-R03","P-09","Vendor provides request-level usage logs with export capability","3","N","Y","50"
"P-09-R04","P-09","Structured, real-time logs exportable to customer SIEM with filtering and alerting","4","N","Y","75"
"P-09-R05","P-09","Tamper-proof audit logs with regulatory-grade retention and independent verification","5","N","Y","100"
"P-11-R01","P-11","API accepts unencrypted HTTP connections with no transport security","1","Y","Y","0"
"P-11-R02","P-11","TLS available but not enforced; Older protocol versions accepted","2","N","Y","25"
"P-11-R03","P-11","TLS 1.2+ enforced for all API connections with valid certificates","3","N","Y","50"
"P-11-R04","P-11","Strong TLS configuration with certificate transparency and security headers","4","N","Y","75"
"P-11-R05","P-11","Mutual TLS available with customer-managed certificates and independent security assessment","5","N","Y","100"
"P-12-R01","P-12","No API versioning; Changes deployed directly with no notice or backward compatibility","1","Y","Y","0"
"P-12-R02","P-12","Version identifiers exist but changes are communicated informally with no guaranteed notice period","2","N","Y","25"
"P-12-R03","P-12","Semantic versioning with documented deprecation policy and minimum notice period","3","N","Y","50"
"P-12-R04","P-12","Long-term version support with parallel access and automated migration tooling","4","N","Y","75"
"P-12-R05","P-12","Contractual version stability with customer-negotiable timelines and backward-compatible evolution","5","N","Y","100"
"P-13-R01","P-13","No visibility into token consumption, costs, or request volumes","1","Y","Y","0"
"P-13-R02","P-13","Monthly invoices with aggregate usage but no real-time visibility or detailed breakdown","2","N","Y","25"
"P-13-R03","P-13","Usage dashboard with per-key, per-model breakdown and daily granularity","3","N","Y","50"
"P-13-R04","P-13","Real-time usage monitoring with budget alerts, projections, and programmatic access","4","N","Y","75"
"P-13-R05","P-13","Full cost attribution with chargeback support, anomaly detection, and contractual billing transparency","5","N","Y","100"
"P-14-R01","P-14","No information about where API requests are processed or data is stored","1","Y","Y","0"
"P-14-R02","P-14","Vendor discloses primary processing region but offers no customer control","2","N","Y","25"
"P-14-R03","P-14","Customer can select a processing region from available options","3","N","Y","50"
"P-14-R04","P-14","Granular geo-routing with contractual data residency guarantees and cross-region failover controls","4","N","Y","75"
"P-14-R05","P-14","Full data sovereignty controls with sovereign cloud options and regulatory-grade residency verification","5","N","Y","100"
"P-15-R01","P-15","API returns unfiltered model outputs with no content safety layer","1","Y","Y","0"
"P-15-R02","P-15","Basic keyword-based output filtering with high false-negative rate","2","N","Y","25"
"P-15-R03","P-15","ML-based content safety filtering on outputs with documented categories","3","N","Y","50"
"P-15-R04","P-15","Multi-layer output filtering with customer-configurable safety thresholds and bypass reporting","4","N","Y","75"
"P-15-R05","P-15","Contractual safety filtering guarantees with continuous improvement SLA and independent evaluation","5","N","Y","100"
"S-02-R01","S-02","Vendor provides no evidence that the AI system meets any regulatory or business rule requirements","1","Y","Y","0"
"S-02-R02","S-02","Vendor claims compliance but provides no audit evidence or certification","2","N","Y","25"
"S-02-R03","S-02","Vendor maps controls to relevant regulatory frameworks and provides compliance documentation","3","N","Y","50"
"S-02-R04","S-02","Vendor provides third-party audit evidence of compliance with relevant frameworks","4","N","Y","75"
"S-02-R05","S-02","Continuous compliance monitoring with real-time customer visibility and regulatory change tracking","5","N","Y","100"
"S-04-R01","S-04","No mechanism for customers to monitor output quality or detect degradation over time","1","Y","Y","0"
"S-04-R02","S-04","Customer relies on manual spot-checking to detect quality changes","2","N","Y","25"
"S-04-R03","S-04","Vendor provides basic usage analytics and performance metrics via dashboard","3","N","Y","50"
"S-04-R04","S-04","Vendor provides output quality monitoring with alerting on degradation","4","N","Y","75"
"S-04-R05","S-04","Contractual quality SLAs with automated drift detection and customer-facing monitoring","5","N","Y","100"
"S-06-R01","S-06","Vendor provides no audit logs or decision records for AI actions on your data","1","Y","Y","0"
"S-06-R02","S-06","Vendor retains internal logs but does not share them with customers","2","N","Y","25"
"S-06-R03","S-06","Vendor provides customer-accessible audit logs of AI decisions and actions","3","N","Y","50"
"S-06-R04","S-06","Structured, exportable audit logs with decision reasoning and integration with customer SIEM","4","N","Y","75"
"S-06-R05","S-06","Immutable, regulatory-grade audit trail with independent verification and contractual guarantees","5","N","Y","100"
"S-09-R01","S-09","Deep integration with proprietary formats and APIs creating prohibitive switching costs","1","Y","Y","0"
"S-09-R02","S-09","Vendor uses partially standard interfaces but core data or models are non-portable","2","N","Y","25"
"S-09-R03","S-09","Vendor provides data export and uses industry-standard API patterns","3","N","Y","50"
"S-09-R04","S-09","Vendor provides comprehensive portability tooling and multi-vendor architecture support","4","N","Y","75"
"S-09-R05","S-09","Vendor-neutral architecture with contractual portability guarantees and assisted migration","5","N","Y","100"
"S-10-R01","S-10","Vendor has no AI ethics policy, review board, or impact assessment process","1","Y","Y","0"
"S-10-R02","S-10","Vendor publishes a general AI ethics statement with no enforcement mechanism or evidence of application","2","N","Y","25"
"S-10-R03","S-10","Vendor maintains an AI ethics policy with documented review processes and impact assessments","3","N","Y","50"
"S-10-R04","S-10","Vendor has an independent AI ethics review board with published findings and customer input mechanisms","4","N","Y","75"
"S-10-R05","S-10","Vendor holds an AI ethics certification or has completed an independent third-party ethics assessment with published results","5","N","Y","100"
"S-11-R01","S-11","No SLA offered for availability, latency, or throughput","1","Y","Y","0"
"S-11-R02","S-11","Vendor provides a best-effort availability target with no financial penalties","2","N","Y","25"
"S-11-R03","S-11","Contractual SLA covering availability with defined service credits for downtime","3","N","Y","50"
"S-11-R04","S-11","Comprehensive SLA covering availability, latency, throughput, and error rates with financial penalties","4","N","Y","75"
"S-11-R05","S-11","Enterprise-grade SLA with custom terms, dedicated support, and real-time performance monitoring","5","N","Y","100"
"S-12-R01","S-12","Vendor has no obligation to notify customers of security incidents, outages, or safety events","1","Y","Y","0"
"S-12-R02","S-12","Vendor maintains a status page but provides no contractual notification obligations","2","N","Y","25"
"S-12-R03","S-12","Contractual obligation to notify customers of material incidents within a defined timeframe","3","N","Y","50"
"S-12-R04","S-12","Proactive incident notification with root cause analysis and customer-specific impact assessment","4","N","Y","75"
"S-12-R05","S-12","Real-time incident visibility with contractual SLAs on notification, RCA, and remediation","5","N","Y","100"
"S-13-R01","S-13","No contractual right to audit vendor's AI-related controls or practices","1","Y","Y","0"
"S-13-R02","S-13","Vendor provides a trust page or FAQ but does not allow direct or third-party audit","2","N","Y","25"
"S-13-R03","S-13","Vendor provides third-party audit reports on request covering standard security controls","3","N","Y","50"
"S-13-R04","S-13","Vendor allows customer-directed audit or provides AI-specific third-party assessments","4","N","Y","75"
"S-13-R05","S-13","Comprehensive audit rights with AI-specific scope, regular cadence, and regulatory alignment","5","N","Y","100"
"S-14-R01","S-14","Vendor does not disclose subprocessors, hosting providers, or underlying model providers","1","Y","Y","0"
"S-14-R02","S-14","Vendor names primary hosting provider but does not disclose full subprocessor chain","2","N","Y","25"
"S-14-R03","S-14","Vendor publishes a subprocessor list covering all entities that process customer data","3","N","Y","50"
"S-14-R04","S-14","Vendor notifies customers of subprocessor changes with advance notice and objection rights","4","N","Y","75"
"S-14-R05","S-14","Full supply chain transparency with contractual controls and independent verification","5","N","Y","100"
"S-15-R01","S-15","Vendor demonstrates no awareness of or alignment with AI-specific regulation","1","Y","Y","0"
"S-15-R02","S-15","Vendor acknowledges upcoming regulation but has taken no concrete compliance steps","2","N","Y","25"
"S-15-R03","S-15","Vendor has mapped controls to at least one major AI regulatory framework","3","N","Y","50"
"S-15-R04","S-15","Vendor holds AI-specific certification or has completed third-party regulatory readiness assessment","4","N","Y","75"
"S-15-R05","S-15","Full regulatory compliance across multiple frameworks with continuous monitoring and customer-facing evidence","5","N","Y","100"
